chart_id,file_name,business_question,chart_type,key_finding,limitation
01,01_category_bar.png,不同生命周期用户的流失率是否存在差异？,柱状图,0-1年新用户流失率(23.8%)约为1-3年老用户(4.9%)的4.8倍，3-5年组仅3人属小样本,3-5年组样本量过小不可外推，横截面数据非时间序列
02,02_behavior_scatter.png,用户订单数与返现金额在流失与否之间有何差异？,散点图,流失用户集中在订单数较低区域，返现金额分布与未流失用户部分重叠,散点重叠影响密度解读；相关不等于因果
03,03_ordered_line.png,不同生命周期阶段流失率的变化趋势如何？,折线图（有序阶段）,从0-1年到1-3年流失率显著下降，呈明显负向梯度,有序阶段比较非时序趋势，3-5年组样本量过小
04,04_composition_chart.png,平台用户流失与未流失的整体构成比例？,饼图,未流失用户占83.2%，已流失16.8%,仅反映当前快照构成，不表示流失速度或时间趋势
05,day06_visualization_summary.png,所有核心图表在同一画布上的综合概览,多子图综合,四图一致显示新用户高流失风险、流失者订单活跃度低,综合图尺寸较小，细节建议查看独立原图
